{
  "schemaVersion": 1,
  "name": "Common actions",
  "description": "Actions every character has. Priorities are deliberately low: they are never the interesting choice, but they must stay reachable.",
  "entries": [
    {
      "definitionId": null,
      "name": "Dash",
      "kind": "action",
      "modes": {
        "combat": 30
      },
      "action": "action",
      "tags": [
        "movement"
      ],
      "source": "hand"
    },
    {
      "definitionId": null,
      "name": "Disengage",
      "kind": "action",
      "modes": {
        "combat": 30
      },
      "action": "action",
      "tags": [
        "movement",
        "defensive"
      ],
      "source": "hand"
    },
    {
      "definitionId": null,
      "name": "Dodge",
      "kind": "action",
      "modes": {
        "combat": 35
      },
      "action": "action",
      "tags": [
        "defensive"
      ],
      "source": "hand",
      "note": "Real answer when you are out of options and being focused."
    },
    {
      "definitionId": null,
      "name": "Grapple",
      "kind": "action",
      "modes": {
        "combat": 25
      },
      "action": "action",
      "tags": [
        "control"
      ],
      "source": "hand"
    },
    {
      "definitionId": null,
      "name": "Help",
      "kind": "action",
      "modes": {
        "combat": 25
      },
      "action": "action",
      "tags": [
        "buff"
      ],
      "source": "hand"
    },
    {
      "definitionId": null,
      "name": "Hide",
      "kind": "action",
      "modes": {
        "combat": 20,
        "explore": 60
      },
      "action": "action",
      "tags": [
        "utility"
      ],
      "source": "hand"
    },
    {
      "definitionId": null,
      "name": "Improvised Weapon",
      "kind": "action",
      "modes": {
        "combat": null
      },
      "action": "action",
      "tags": [
        "attack"
      ],
      "source": "hand",
      "note": "Drawer until the table makes it matter."
    },
    {
      "definitionId": null,
      "name": "Ready",
      "kind": "action",
      "modes": {
        "combat": 20
      },
      "action": "action",
      "tags": [
        "utility"
      ],
      "source": "hand"
    },
    {
      "definitionId": null,
      "name": "Search",
      "kind": "action",
      "modes": {
        "combat": 10,
        "explore": 70
      },
      "action": "action",
      "tags": [
        "utility"
      ],
      "source": "hand"
    },
    {
      "definitionId": null,
      "name": "Shove",
      "kind": "action",
      "modes": {
        "combat": 25
      },
      "action": "action",
      "tags": [
        "control"
      ],
      "source": "hand"
    },
    {
      "definitionId": null,
      "name": "Unarmed Strike",
      "kind": "action",
      "modes": {
        "combat": null
      },
      "action": "action",
      "tags": [
        "attack"
      ],
      "source": "hand",
      "note": "Drawer: the thing DDB opens on and nobody plans a turn around. Still one tap away."
    },
    {
      "definitionId": null,
      "name": "Use an Object",
      "kind": "action",
      "modes": {
        "combat": 15
      },
      "action": "action",
      "tags": [
        "utility"
      ],
      "source": "hand"
    }
  ]
}
